{
  "schemaVersion": 3,
  "source": "surface-conformance:stale-expired-window",
  "claims": [
    {
      "id": "claim.api.rate-limit",
      "subjectType": "api",
      "subjectId": "public-api",
      "surface": "api.guarantees",
      "claimType": "software-evidence",
      "fieldOrBehavior": "rate limit is enforced",
      "value": "100 requests/minute",
      "createdAt": "2026-04-25T00:00:00.000Z",
      "updatedAt": "2026-04-25T00:05:00.000Z",
      "impactLevel": "high",
      "verificationPolicyId": "policy.field.short-lived"
    }
  ],
  "evidence": [
    {
      "id": "evidence.api.rate-limit.test",
      "claimId": "claim.api.rate-limit",
      "evidenceType": "test_output",
      "method": "validation",
      "sourceRef": "ci:1847",
      "excerptOrSummary": "Rate-limit tests passed.",
      "observedAt": "2026-04-25T00:05:00.000Z",
      "collectedBy": "ci",
      "integrityRef": "commit:abc123"
    }
  ],
  "policies": [
    {
      "id": "policy.field.short-lived",
      "claimType": "software-evidence",
      "requiredEvidence": [
        "test_output"
      ],
      "requiredMethods": [
        "validation"
      ],
      "requiresCorroboration": false,
      "acceptanceCriteria": [
        "recent validation within the validity window"
      ],
      "reviewAuthority": "operator",
      "validityRule": {
        "kind": "duration",
        "durationDays": 14
      },
      "stalenessTriggers": [
        "validity window expires"
      ],
      "conflictRules": [],
      "impactLevel": "high"
    }
  ],
  "events": [
    {
      "id": "event.api.rate-limit.verified",
      "claimId": "claim.api.rate-limit",
      "status": "verified",
      "actor": "ci",
      "method": "npm test",
      "evidenceIds": [
        "evidence.api.rate-limit.test"
      ],
      "createdAt": "2025-01-01T00:00:00.000Z",
      "verifiedAt": "2025-01-01T00:00:00.000Z"
    }
  ]
}