{
  "schemaVersion": 3,
  "source": "surface-conformance:unknown-no-evidence",
  "claims": [
    {
      "id": "claim.api.rate-limit",
      "subjectType": "api",
      "subjectId": "public-api",
      "surface": "api.guarantees",
      "claimType": "software-evidence",
      "fieldOrBehavior": "rate limit is enforced",
      "value": "100 requests/minute",
      "createdAt": "2026-04-25T00:00:00.000Z",
      "updatedAt": "2026-04-25T00:05:00.000Z",
      "impactLevel": "high",
      "currentIntegrityRef": "commit:abc123",
      "verificationPolicyId": "policy.software-evidence.commit"
    }
  ],
  "evidence": [],
  "policies": [
    {
      "id": "policy.software-evidence.commit",
      "claimType": "software-evidence",
      "requiredEvidence": [
        "test_output"
      ],
      "requiredMethods": [
        "validation"
      ],
      "requiresCorroboration": false,
      "acceptanceCriteria": [
        "evidence check passes for the affected commit"
      ],
      "reviewAuthority": "repo policy",
      "validityRule": {
        "kind": "commit"
      },
      "stalenessTriggers": [
        "new commit touches the same surface"
      ],
      "conflictRules": [],
      "impactLevel": "high"
    }
  ],
  "events": []
}