{
  "schemaVersion": 3,
  "source": "kontour-surface-validation-examples",
  "identityLinks": [
    {
      "subjects": [
        { "subjectType": "repo-surface", "subjectId": "example/repo:src/api" },
        { "subjectType": "release-channel", "subjectId": "repo-governance:api" }
      ],
      "reason": "API source and the named release channel describe the same surface."
    }
  ],
  "claims": [
    {
      "id": "claim.repo-governance.api-proof",
      "subjectType": "repo-surface",
      "subjectId": "example/repo:src/api",
      "surface": "repo-governance.developer-evidence",
      "claimType": "software-evidence",
      "fieldOrBehavior": "acceptanceCriteriaLane",
      "value": "npm test passed for API surface change",
      "createdAt": "2026-04-25T00:00:00.000Z",
      "updatedAt": "2026-04-25T00:05:00.000Z",
      "impactLevel": "high",
      "currentIntegrityRef": "commit-or-run-id-placeholder",
      "verificationPolicyId": "policy.software-evidence.commit",
      "subjectAliases": [
        { "subjectType": "release-channel", "subjectId": "repo-governance:api" }
      ],
      "confidenceBasis": {
        "sourceQuality": "strong",
        "reviewerAuthority": "system",
        "evidenceStrength": "strong",
        "impactLevel": "high"
      }
    },
    {
      "id": "claim.field-attested-records.registration-status",
      "subjectType": "attested-record",
      "subjectId": "field-attested-records:denver-example-record",
      "surface": "field-attested-records.public-data",
      "claimType": "public-data-field",
      "fieldOrBehavior": "registrationStatus",
      "value": "OPEN",
      "createdAt": "2026-04-01T00:00:00.000Z",
      "updatedAt": "2026-04-01T00:00:00.000Z",
      "impactLevel": "high",
      "verificationPolicyId": "policy.public-data-field.short-lived",
      "confidenceBasis": {
        "sourceQuality": "strong",
        "extractionConfidence": 0.92,
        "corroborationCount": 1,
        "reviewerAuthority": "operator",
        "evidenceStrength": "moderate",
        "impactLevel": "high"
      }
    },
    {
      "id": "claim.fact-resolution.w2-wages",
      "subjectType": "fact",
      "subjectId": "fact-resolution:demo-case-2025:w2.wages",
      "surface": "fact-resolution.financial-facts",
      "claimType": "verified-financial-fact",
      "fieldOrBehavior": "w2.wages",
      "value": 123456,
      "createdAt": "2026-04-20T00:00:00.000Z",
      "updatedAt": "2026-04-20T00:00:00.000Z",
      "impactLevel": "critical",
      "verificationPolicyId": "policy.financial-fact.historical",
      "confidenceBasis": {
        "sourceQuality": "strong",
        "corroborationCount": 2,
        "reviewerAuthority": "domain_expert",
        "evidenceStrength": "strong",
        "impactLevel": "critical"
      }
    },
    {
      "id": "claim.surface.future-console",
      "subjectType": "roadmap-item",
      "subjectId": "kontour-surface:hosted-console",
      "surface": "surface.roadmap",
      "claimType": "roadmap-capability",
      "fieldOrBehavior": "implementationStatus",
      "value": "planned",
      "createdAt": "2026-04-25T00:00:00.000Z",
      "updatedAt": "2026-04-25T00:00:00.000Z",
      "impactLevel": "medium",
      "verificationPolicyId": "policy.roadmap.manual"
    }
  ],
  "evidence": [
    {
      "id": "evidence.repo-governance.test-output",
      "passing": true,
      "claimId": "claim.repo-governance.api-proof",
      "evidenceType": "test_output",
      "method": "validation",
      "sourceRef": "repo governance evidence check",
      "sourceLocator": "npm test",
      "excerptOrSummary": "84 tests passed for the verified repo state.",
      "observedAt": "2026-04-25T00:05:00.000Z",
      "collectedBy": "repo-governance",
      "integrityRef": "commit-or-run-id-placeholder"
    },
    {
      "id": "evidence.field-attested-records.source-excerpt",
      "claimId": "claim.field-attested-records.registration-status",
      "evidenceType": "source_excerpt",
      "method": "observation",
      "sourceRef": "https://example.org/camps/register",
      "sourceLocator": "registration section",
      "excerptOrSummary": "Registration is open now for summer sessions.",
      "observedAt": "2026-04-01T00:00:00.000Z",
      "collectedBy": "field-data-crawler"
    },
    {
      "id": "evidence.field-attested-records.admin-attestation",
      "claimId": "claim.field-attested-records.registration-status",
      "evidenceType": "human_attestation",
      "method": "attestation",
      "sourceRef": "record steward review",
      "sourceLocator": "FieldAttestation.registrationStatus",
      "excerptOrSummary": "Admin approved the registration status from the source excerpt.",
      "observedAt": "2026-04-01T00:10:00.000Z",
      "collectedBy": "record-steward"
    },
    {
      "id": "evidence.fact-resolution.document-citation",
      "claimId": "claim.fact-resolution.w2-wages",
      "evidenceType": "document_citation",
      "method": "corroboration",
      "sourceRef": "W-2 imported document",
      "sourceLocator": "Box 1",
      "excerptOrSummary": "W-2 Box 1 wages matched the verified fact value.",
      "observedAt": "2026-04-20T00:00:00.000Z",
      "collectedBy": "fact-importer",
      "integrityRef": "document-hash-placeholder"
    },
    {
      "id": "evidence.fact-resolution.calculation-trace",
      "passing": true,
      "claimId": "claim.fact-resolution.w2-wages",
      "evidenceType": "calculation_trace",
      "method": "validation",
      "sourceRef": "fact resolution package",
      "sourceLocator": "verified_facts.w2.wages",
      "excerptOrSummary": "Resolved fact was promoted to verified_facts before downstream analysis.",
      "observedAt": "2026-04-20T00:15:00.000Z",
      "collectedBy": "fact-resolution-service"
    }
  ],
  "policies": [
    {
      "id": "policy.software-evidence.commit",
      "claimType": "software-evidence",
      "parentType": "developer-claim",
      "requiredEvidence": ["test_output"],
      "requiredMethods": ["validation"],
      "requiresCorroboration": false,
      "acceptanceCriteria": ["evidence check passes for the affected commit or diff"],
      "reviewAuthority": "repo policy",
      "validityRule": { "kind": "commit" },
      "stalenessTriggers": ["new commit touches the same surface", "evidence check changes"],
      "conflictRules": ["failed evidence check supersedes prior passing evidence"],
      "impactLevel": "high",
      "incompatibleStatuses": [
        {
          "statuses": ["verified", "rejected"],
          "message": "A surface cannot be simultaneously verified and rejected at the same commit."
        }
      ]
    },
    {
      "id": "policy.public-data-field.short-lived",
      "claimType": "public-data-field",
      "requiredEvidence": ["source_excerpt", "human_attestation"],
      "requiredMethods": ["observation", "attestation"],
      "requiresCorroboration": true,
      "acceptanceCriteria": ["field-level review or crawl approval"],
      "reviewAuthority": "operator",
      "validityRule": { "kind": "duration", "durationDays": 14 },
      "stalenessTriggers": ["source page changes", "validity window expires", "user report conflicts"],
      "conflictRules": ["new source excerpt conflicts with approved value"],
      "impactLevel": "high"
    },
    {
      "id": "policy.financial-fact.historical",
      "claimType": "verified-financial-fact",
      "requiredEvidence": ["document_citation", "calculation_trace"],
      "requiredMethods": ["corroboration", "validation"],
      "requiresCorroboration": true,
      "acceptanceCriteria": ["resolved fact promoted to verified fact"],
      "reviewAuthority": "domain expert",
      "validityRule": { "kind": "historical" },
      "stalenessTriggers": ["new source document imported", "conflicting candidate appears"],
      "conflictRules": ["multi-candidate facts require manual resolution"],
      "impactLevel": "critical"
    },
    {
      "id": "policy.roadmap.manual",
      "claimType": "roadmap-capability",
      "requiredEvidence": ["human_attestation"],
      "requiredMethods": ["attestation"],
      "requiresCorroboration": false,
      "acceptanceCriteria": ["explicit roadmap acceptance"],
      "reviewAuthority": "product owner",
      "validityRule": { "kind": "manual" },
      "stalenessTriggers": ["roadmap changed"],
      "conflictRules": ["implementation claim without shipped evidence is unsupported"],
      "impactLevel": "medium"
    }
  ],
  "events": [
    {
      "id": "event.repo-governance.verified",
      "claimId": "claim.repo-governance.api-proof",
      "status": "verified",
      "actor": "repo-governance",
      "method": "evidence-check",
      "evidenceIds": ["evidence.repo-governance.test-output"],
      "createdAt": "2026-04-25T00:05:00.000Z",
      "verifiedAt": "2026-04-25T00:05:00.000Z"
    },
    {
      "id": "event.field-attested-records.verified",
      "claimId": "claim.field-attested-records.registration-status",
      "status": "verified",
      "actor": "record-steward",
      "method": "field-attestation",
      "evidenceIds": ["evidence.field-attested-records.source-excerpt", "evidence.field-attested-records.admin-attestation"],
      "createdAt": "2026-04-01T00:10:00.000Z",
      "verifiedAt": "2026-04-01T00:10:00.000Z"
    },
    {
      "id": "event.fact-resolution.verified",
      "claimId": "claim.fact-resolution.w2-wages",
      "status": "verified",
      "actor": "fact-resolution-service",
      "method": "verified-fact-promotion",
      "evidenceIds": ["evidence.fact-resolution.document-citation", "evidence.fact-resolution.calculation-trace"],
      "createdAt": "2026-04-20T00:15:00.000Z",
      "verifiedAt": "2026-04-20T00:15:00.000Z"
    }
  ]
}
